{
  "contractVersion": 1,
  "kind": "lookup",
  "expectedSha": "ee304c5c9ee2d72267b5092eb83f5546d8658baa",
  "generatedAt": "2026-10-16T08:00:00.000Z",
  "engine": {
    "name": "renovate",
    "image": "renovate/renovate:44.125.2@sha256:a7dec3432d62b39872058424f0490829413b3f597f5d72fb41b9b7bd57ccac77",
    "seconds": null
  },
  "records": [
    {
      "ecosystem": "platform:node",
      "manager": "asdf",
      "datasource": "node-version",
      "packageFile": ".tool-versions",
      "lockFiles": [],
      "depName": "node",
      "packageName": "node",
      "depType": null,
      "currentValue": "20.11.0",
      "currentVersion": "v20.11.0",
      "lockedVersion": null,
      "currentDigest": null,
      "replaceString": null,
      "sharedVariableName": null,
      "groupName": null,
      "skipReason": null,
      "hold": false,
      "candidates": [
        {
          "version": "v20.20.2",
          "value": "20.20.2",
          "updateType": "minor",
          "releaseTimestamp": "2026-03-24T00:00:00.000Z",
          "digest": null,
          "isBreaking": false,
          "isLockfileUpdate": false,
          "groupName": null,
          "branchName": "renovate/node-20.x",
          "missing": []
        },
        {
          "version": "v24.22.0",
          "value": "24.22.0",
          "updateType": "major",
          "releaseTimestamp": "2026-10-14T00:00:00.000Z",
          "digest": null,
          "isBreaking": true,
          "isLockfileUpdate": false,
          "groupName": null,
          "branchName": "renovate/node-24.x",
          "missing": []
        }
      ]
    },
    {
      "ecosystem": "platform:python",
      "manager": "asdf",
      "datasource": "github-tags",
      "packageFile": ".tool-versions",
      "lockFiles": [],
      "depName": "python",
      "packageName": "python/cpython",
      "depType": null,
      "currentValue": "3.11.4",
      "currentVersion": "3.11.4",
      "lockedVersion": null,
      "currentDigest": null,
      "replaceString": null,
      "sharedVariableName": null,
      "groupName": null,
      "skipReason": null,
      "hold": false,
      "candidates": [
        {
          "version": "3.15.0",
          "value": "3.15.0",
          "updateType": "minor",
          "releaseTimestamp": "2026-10-09T11:16:41.000Z",
          "digest": null,
          "isBreaking": false,
          "isLockfileUpdate": false,
          "groupName": null,
          "branchName": "renovate/python-3.x",
          "missing": []
        }
      ]
    },
    {
      "ecosystem": "platform:go",
      "manager": "asdf",
      "datasource": "github-tags",
      "packageFile": ".tool-versions",
      "lockFiles": [],
      "depName": "golang",
      "packageName": "golang/go",
      "depType": null,
      "currentValue": "1.21.0",
      "currentVersion": "1.21.0",
      "lockedVersion": null,
      "currentDigest": null,
      "replaceString": null,
      "sharedVariableName": null,
      "groupName": null,
      "skipReason": null,
      "hold": false,
      "candidates": [
        {
          "version": "1.27.2",
          "value": "1.27.2",
          "updateType": "minor",
          "releaseTimestamp": "2026-10-08T15:36:10.000Z",
          "digest": null,
          "isBreaking": false,
          "isLockfileUpdate": false,
          "groupName": null,
          "branchName": "renovate/golang-1.x",
          "missing": []
        }
      ]
    },
    {
      "ecosystem": "platform:java",
      "manager": "asdf",
      "datasource": "java-version",
      "packageFile": ".tool-versions",
      "lockFiles": [],
      "depName": "java",
      "packageName": "java-jdk",
      "depType": null,
      "currentValue": "17.0.8+7",
      "currentVersion": "17.0.8+7",
      "lockedVersion": null,
      "currentDigest": null,
      "replaceString": null,
      "sharedVariableName": null,
      "groupName": null,
      "skipReason": null,
      "hold": false,
      "candidates": [
        {
          "version": "17.0.20+8",
          "value": "17.0.20+8",
          "updateType": "patch",
          "releaseTimestamp": null,
          "digest": null,
          "isBreaking": false,
          "isLockfileUpdate": false,
          "groupName": null,
          "branchName": "renovate/java-17.x",
          "missing": [
            "releaseTimestamp"
          ]
        },
        {
          "version": "27.0.0+35",
          "value": "27.0.0+35",
          "updateType": "major",
          "releaseTimestamp": null,
          "digest": null,
          "isBreaking": true,
          "isLockfileUpdate": false,
          "groupName": null,
          "branchName": "renovate/java-27.x",
          "missing": [
            "releaseTimestamp"
          ]
        }
      ]
    },
    {
      "ecosystem": "docker",
      "manager": "dockerfile",
      "datasource": "docker",
      "packageFile": "Dockerfile",
      "lockFiles": [],
      "depName": "node",
      "packageName": "node",
      "depType": "stage",
      "currentValue": "20.11.0-alpine",
      "currentVersion": "20.11.0",
      "lockedVersion": null,
      "currentDigest": null,
      "replaceString": "node:20.11.0-alpine",
      "sharedVariableName": null,
      "groupName": null,
      "skipReason": null,
      "hold": false,
      "candidates": [
        {
          "version": "20.20.2",
          "value": "20.20.2-alpine",
          "updateType": "minor",
          "releaseTimestamp": null,
          "digest": null,
          "isBreaking": false,
          "isLockfileUpdate": false,
          "groupName": null,
          "branchName": "renovate/node-20.x",
          "missing": [
            "releaseTimestamp"
          ]
        },
        {
          "version": "26.12.0",
          "value": "26.12.0-alpine",
          "updateType": "major",
          "releaseTimestamp": null,
          "digest": null,
          "isBreaking": true,
          "isLockfileUpdate": false,
          "groupName": null,
          "branchName": "renovate/node-26.x",
          "missing": [
            "releaseTimestamp"
          ]
        }
      ]
    },
    {
      "ecosystem": "docker",
      "manager": "dockerfile",
      "datasource": "docker",
      "packageFile": "Dockerfile",
      "lockFiles": [],
      "depName": "mcr.microsoft.com/dotnet/sdk",
      "packageName": "mcr.microsoft.com/dotnet/sdk",
      "depType": "stage",
      "currentValue": "8.0.100",
      "currentVersion": "8.0.100",
      "lockedVersion": null,
      "currentDigest": null,
      "replaceString": "mcr.microsoft.com/dotnet/sdk:8.0.100",
      "sharedVariableName": null,
      "groupName": null,
      "skipReason": null,
      "hold": false,
      "candidates": [
        {
          "version": "8.0.426",
          "value": "8.0.426",
          "updateType": "patch",
          "releaseTimestamp": null,
          "digest": null,
          "isBreaking": false,
          "isLockfileUpdate": false,
          "groupName": null,
          "branchName": "renovate/mcr.microsoft.com-dotnet-sdk-8.x",
          "missing": [
            "releaseTimestamp"
          ]
        },
        {
          "version": "10.0.402",
          "value": "10.0.402",
          "updateType": "major",
          "releaseTimestamp": null,
          "digest": null,
          "isBreaking": true,
          "isLockfileUpdate": false,
          "groupName": null,
          "branchName": "renovate/mcr.microsoft.com-dotnet-sdk-10.x",
          "missing": [
            "releaseTimestamp"
          ]
        }
      ]
    },
    {
      "ecosystem": "docker",
      "manager": "dockerfile",
      "datasource": "docker",
      "packageFile": "Dockerfile",
      "lockFiles": [],
      "depName": "mcr.microsoft.com/dotnet/aspnet",
      "packageName": "mcr.microsoft.com/dotnet/aspnet",
      "depType": "stage",
      "currentValue": "8.0",
      "currentVersion": "8.0",
      "lockedVersion": null,
      "currentDigest": null,
      "replaceString": "mcr.microsoft.com/dotnet/aspnet:8.0",
      "sharedVariableName": null,
      "groupName": null,
      "skipReason": null,
      "hold": false,
      "candidates": [
        {
          "version": "11.0",
          "value": "11.0",
          "updateType": "major",
          "releaseTimestamp": null,
          "digest": null,
          "isBreaking": true,
          "isLockfileUpdate": false,
          "groupName": null,
          "branchName": "renovate/mcr.microsoft.com-dotnet-aspnet-11.x",
          "missing": [
            "releaseTimestamp"
          ]
        }
      ]
    },
    {
      "ecosystem": "docker",
      "manager": "dockerfile",
      "datasource": "docker",
      "packageFile": "Dockerfile",
      "lockFiles": [],
      "depName": "python",
      "packageName": "python",
      "depType": "stage",
      "currentValue": "3.11-slim",
      "currentVersion": "3.11",
      "lockedVersion": null,
      "currentDigest": "sha256:0000000000000000000000000000000000000000000000000000000000000000",
      "replaceString": "python:3.11-slim@sha256:0000000000000000000000000000000000000000000000000000000000000000",
      "sharedVariableName": null,
      "groupName": null,
      "skipReason": null,
      "hold": false,
      "candidates": [
        {
          "version": "3.15",
          "value": "3.15-slim",
          "updateType": "minor",
          "releaseTimestamp": null,
          "digest": "sha256:f48fda6d59b2b3437781d1c3ccf4aa0e26ae871de3cdd758b49ab45ee7291619",
          "isBreaking": false,
          "isLockfileUpdate": false,
          "groupName": null,
          "branchName": "renovate/python-3.x",
          "missing": [
            "releaseTimestamp"
          ]
        },
        {
          "version": null,
          "value": "3.11-slim",
          "updateType": "digest",
          "releaseTimestamp": null,
          "digest": "sha256:e88e9763f943ec1834f992a4b51e0f24500486803e8bc534e5767af9ea65f6ce",
          "isBreaking": false,
          "isLockfileUpdate": false,